[
  {
    "id": "handle-dfc366e1fe2f",
    "platform": "tiktok",
    "username": "dinklygame",
    "canonical_url": "https://www.tiktok.com/@dinklygame",
    "display_name": "dinklygame",
    "category": "Owned account",
    "enabled": true,
    "provider": "apify",
    "posts_per_refresh": 20,
    "refresh_frequency": "Daily",
    "last_checked_at": "2026-08-06T22:44:31.730905+00:00",
    "last_success_at": "2026-08-06T22:44:31.730905+00:00",
    "last_error": null,
    "profile_id": "profile-76d92cc73043",
    "profile_image_url": "https://p16-common-sign.tiktokcdn-us.com/tos-useast5-avt-0068-tx/7557c570e4547ff2db94486a8a055e00~tplv-tiktokx-cropcenter:720:720.jpeg?dr=9640&refresh_token=58ed61c4&x-expires=1786226400&x-signature=ug6tqZXBjPPUNb%2B73FcdCXfVOVU%3D&t=4d5b0474&ps=13740610&shp=a5d48078&shcp=81f88b70&idc=useast8",
    "follower_count": 17900,
    "following_count": 0,
    "post_count": null,
    "notes": "",
    "created_at": "2026-08-06T22:22:37.865394+00:00",
    "updated_at": "2026-08-06T22:44:31.730905+00:00"
  },
  {
    "id": "handle-5ad261714d26",
    "platform": "instagram",
    "username": "dinklygame",
    "canonical_url": "https://www.instagram.com/dinklygame/",
    "display_name": null,
    "category": "Owned account",
    "enabled": true,
    "provider": "apify",
    "posts_per_refresh": 20,
    "refresh_frequency": "Off",
    "last_checked_at": "2026-08-06T22:44:31.933015+00:00",
    "last_success_at": null,
    "last_error": "The configured Apify Actor is unavailable. Review the Actor ID in Settings.",
    "profile_id": null,
    "profile_image_url": null,
    "follower_count": null,
    "following_count": null,
    "post_count": null,
    "notes": "",
    "created_at": "2026-08-06T22:22:37.875783+00:00",
    "updated_at": "2026-08-06T22:44:31.933015+00:00"
  },
  {
    "id": "handle-e908bd080592",
    "platform": "instagram",
    "username": "sundaekids",
    "canonical_url": "https://www.instagram.com/sundaekids/",
    "display_name": null,
    "category": "Inspiration",
    "enabled": true,
    "provider": "apify",
    "posts_per_refresh": 20,
    "refresh_frequency": "Weekly",
    "last_checked_at": null,
    "last_success_at": null,
    "last_error": null,
    "profile_id": null,
    "profile_image_url": null,
    "follower_count": null,
    "following_count": null,
    "post_count": null,
    "notes": "",
    "created_at": "2026-08-06T22:24:49.512822+00:00",
    "updated_at": "2026-08-06T22:25:05.880857+00:00"
  },
  {
    "id": "handle-9ec0d7ed28d6",
    "platform": "instagram",
    "username": "victorianpoetry",
    "canonical_url": "https://www.instagram.com/victorianpoetry/",
    "display_name": null,
    "category": "Inspiration",
    "enabled": true,
    "provider": "apify",
    "posts_per_refresh": 20,
    "refresh_frequency": "Every 3 days",
    "last_checked_at": null,
    "last_success_at": null,
    "last_error": null,
    "profile_id": null,
    "profile_image_url": null,
    "follower_count": null,
    "following_count": null,
    "post_count": null,
    "notes": "",
    "created_at": "2026-08-06T22:24:49.526369+00:00",
    "updated_at": "2026-08-06T22:25:07.320137+00:00"
  }
]
